{
  "schemaVersion": 1,
  "badgeLabel": "HEARTHCODE",
  "headline": "Four stable starting points",
  "subheadline": "Moss and Ember, each shown in Dark and Light with real syntax and editor chrome.",
  "familyLabels": {
    "dark": "DARK STARTING POINTS",
    "light": "LIGHT STARTING POINTS"
  },
  "variantNames": {
    "dark": "Ember Dark",
    "light": "Ember Light"
  }
}
